{
  "schemaVersion": 1,
  "month": "2026-08",
  "timezone": "Europe/Berlin",
  "budgetEur": 5.0,
  "estimatedCostUsd": 9.525929,
  "estimatedCostEur": 8.363762,
  "budgetPercent": 167.3,
  "unmeasuredCalls": 11,
  "collectionStartedAt": "2026-08-03T00:00:00+02:00",
  "priceVersion": "anthropic-2026-08-03",
  "rate": {
    "usdToEur": 0.878,
    "effectiveDate": "2026-07-27"
  },
  "events": [
    {
      "eventId": "c9fc784916478ff2451ecfb9d534bf09d2bdd3beb7108c30da388a26c8312cf1",
      "occurredAt": "2026-08-04T11:49:12.897427+00:00",
      "reportType": "daily",
      "reportId": "2026-08-04",
      "model": "claude-haiku-4-5-20251001",
      "outcome": "end_turn",
      "measured": true,
      "usage": {
        "input_tokens": 18723,
        "output_tokens": 2183,
        "cache_creation_input_tokens": 0,
        "cache_read_input_tokens": 0
      },
      "estimatedCostUsd": 0.029638,
      "estimatedCostEur": 0.026022
    },
    {
      "eventId": "201a6c9469aed0c8ac5128195850b85f06cfd42edb160368dd03c2fe0a4829ba",
      "occurredAt": "2026-08-04T11:50:30.199419+00:00",
      "reportType": "daily",
      "reportId": "2026-08-04",
      "model": "claude-sonnet-4-6",
      "outcome": "end_turn",
      "measured": true,
      "usage": {
        "input_tokens": 9347,
        "output_tokens": 3704,
        "cache_creation_input_tokens": 0,
        "cache_read_input_tokens": 0
      },
      "estimatedCostUsd": 0.083601,
      "estimatedCostEur": 0.073402
    },
    {
      "eventId": "0467affa3242b139ad47d3c20b084586bbd5ab793e3749620147935a867867e5",
      "occurredAt": "2026-08-04T11:52:06.689912+00:00",
      "reportType": "daily",
      "reportId": "2026-08-04",
      "model": "claude-sonnet-4-6",
      "outcome": "end_turn",
      "measured": true,
      "usage": {
        "input_tokens": 13263,
        "output_tokens": 5665,
        "cache_creation_input_tokens": 0,
        "cache_read_input_tokens": 0
      },
      "estimatedCostUsd": 0.124764,
      "estimatedCostEur": 0.109543
    },
    {
      "eventId": "a2d4417e3a65976477aea5ba01a40398ccbd0b814e1c0471a5276f10d79691fc",
      "occurredAt": "2026-08-05T11:39:05.060789+00:00",
      "reportType": "daily",
      "reportId": "2026-08-05",
      "model": "claude-haiku-4-5-20251001",
      "outcome": "end_turn",
      "measured": true,
      "usage": {
        "input_tokens": 18424,
        "output_tokens": 2116,
        "cache_creation_input_tokens": 0,
        "cache_read_input_tokens": 0
      },
      "estimatedCostUsd": 0.029004,
      "estimatedCostEur": 0.025466
    },
    {
      "eventId": "abc3ec1d417ef6cef1b5c03d219db792aac408e56fc7cf899833380e0c4b5183",
      "occurredAt": "2026-08-05T11:40:41.877164+00:00",
      "reportType": "daily",
      "reportId": "2026-08-05",
      "model": "claude-sonnet-4-6",
      "outcome": "end_turn",
      "measured": true,
      "usage": {
        "input_tokens": 9623,
        "output_tokens": 4635,
        "cache_creation_input_tokens": 0,
        "cache_read_input_tokens": 0
      },
      "estimatedCostUsd": 0.098394,
      "estimatedCostEur": 0.08639
    },
    {
      "eventId": "20d2f7af8e2efea5bb4960cb72ee87b02cd179f2dc601231ae225b812298bf01",
      "occurredAt": "2026-08-06T11:52:24.722308+00:00",
      "reportType": "daily",
      "reportId": "2026-08-06",
      "model": "claude-haiku-4-5-20251001",
      "outcome": "end_turn",
      "measured": true,
      "usage": {
        "input_tokens": 18872,
        "output_tokens": 3861,
        "cache_creation_input_tokens": 0,
        "cache_read_input_tokens": 0
      },
      "estimatedCostUsd": 0.038177,
      "estimatedCostEur": 0.033519
    },
    {
      "eventId": "9810f3b3ff5ec2ed7dbfbbee27e84f177f663a3411533c73e25ccf6b45319672",
      "occurredAt": "2026-08-06T11:54:05.013865+00:00",
      "reportType": "daily",
      "reportId": "2026-08-06",
      "model": "claude-sonnet-4-6",
      "outcome": "end_turn",
      "measured": true,
      "usage": {
        "input_tokens": 12194,
        "output_tokens": 4961,
        "cache_creation_input_tokens": 0,
        "cache_read_input_tokens": 0
      },
      "estimatedCostUsd": 0.110997,
      "estimatedCostEur": 0.097455
    },
    {
      "eventId": "9ae7bde53f2ec418f51ff155f67b62ead7b38e7b0171bd4f4ce17606439cdfdd",
      "occurredAt": "2026-08-07T08:02:38.902487+00:00",
      "reportType": "daily",
      "reportId": "2026-08-07",
      "model": "claude-haiku-4-5-20251001",
      "outcome": "end_turn",
      "measured": true,
      "usage": {
        "input_tokens": 17973,
        "output_tokens": 2363,
        "cache_creation_input_tokens": 0,
        "cache_read_input_tokens": 0
      },
      "estimatedCostUsd": 0.029788,
      "estimatedCostEur": 0.026154
    },
    {
      "eventId": "7a7ed5a916c32f2e30045c9cbc8e3ba2fc3447ef51a7e111ee88d9e487d783be",
      "occurredAt": "2026-08-07T08:04:15.288582+00:00",
      "reportType": "daily",
      "reportId": "2026-08-07",
      "model": "claude-sonnet-4-6",
      "outcome": "end_turn",
      "measured": true,
      "usage": {
        "input_tokens": 10330,
        "output_tokens": 5255,
        "cache_creation_input_tokens": 0,
        "cache_read_input_tokens": 0
      },
      "estimatedCostUsd": 0.109815,
      "estimatedCostEur": 0.096418
    },
    {
      "eventId": "fa6399edd54151961c2ef6c03141c1c94e2d1320a503861132283af4fcbc66df",
      "occurredAt": "2026-08-08T06:01:20.547522+00:00",
      "reportType": "daily",
      "reportId": "2026-08-08",
      "model": "claude-haiku-4-5-20251001",
      "outcome": "end_turn",
      "measured": true,
      "usage": {
        "input_tokens": 19163,
        "output_tokens": 2397,
        "cache_creation_input_tokens": 0,
        "cache_read_input_tokens": 0
      },
      "estimatedCostUsd": 0.031148,
      "estimatedCostEur": 0.027348
    },
    {
      "eventId": "d58611ad82a60e4d6b35b0fb8fd01f7e075b398cadbc91ad3b54242a2eed8172",
      "occurredAt": "2026-08-08T06:02:37.300400+00:00",
      "reportType": "daily",
      "reportId": "2026-08-08",
      "model": "claude-sonnet-4-6",
      "outcome": "end_turn",
      "measured": true,
      "usage": {
        "input_tokens": 11131,
        "output_tokens": 4179,
        "cache_creation_input_tokens": 0,
        "cache_read_input_tokens": 0
      },
      "estimatedCostUsd": 0.096078,
      "estimatedCostEur": 0.084356
    },
    {
      "eventId": "a3c506fa0304bbc5ef9cfef876c092bf81946f6183ed4b6c8c1b9c6b16b2d528",
      "occurredAt": "2026-08-09T06:06:53.950005+00:00",
      "reportType": "daily",
      "reportId": "2026-08-09",
      "model": "claude-haiku-4-5-20251001",
      "outcome": "end_turn",
      "measured": true,
      "usage": {
        "input_tokens": 24205,
        "output_tokens": 4439,
        "cache_creation_input_tokens": 0,
        "cache_read_input_tokens": 0
      },
      "estimatedCostUsd": 0.0464,
      "estimatedCostEur": 0.040739
    },
    {
      "eventId": "0c83766c8991c5c9180939246783c0a28e3b51c9ac413ada588894658b54f50b",
      "occurredAt": "2026-08-09T06:08:41.957044+00:00",
      "reportType": "daily",
      "reportId": "2026-08-09",
      "model": "claude-sonnet-4-6",
      "outcome": "end_turn",
      "measured": true,
      "usage": {
        "input_tokens": 15635,
        "output_tokens": 4982,
        "cache_creation_input_tokens": 0,
        "cache_read_input_tokens": 0
      },
      "estimatedCostUsd": 0.121635,
      "estimatedCostEur": 0.106796
    },
    {
      "eventId": "f6f8e1cf4f9829d7cacbee423f2119e126b540ec6e51a16fd1f2b8513f64008c",
      "occurredAt": "2026-08-09T06:09:19.288144+00:00",
      "reportType": "daily",
      "reportId": "2026-08-09",
      "model": "claude-haiku-4-5-20251001",
      "outcome": "end_turn",
      "measured": true,
      "usage": {
        "input_tokens": 6695,
        "output_tokens": 3774,
        "cache_creation_input_tokens": 0,
        "cache_read_input_tokens": 0
      },
      "estimatedCostUsd": 0.025565,
      "estimatedCostEur": 0.022446
    },
    {
      "eventId": "a2cc6abd9a693b83713e65f9a3ab1d4abc442879bd53ddab68c8348811390981",
      "occurredAt": "2026-08-10T09:01:11.720085+00:00",
      "reportType": "daily",
      "reportId": "2026-08-10",
      "model": "claude-haiku-4-5-20251001",
      "outcome": "end_turn",
      "measured": true,
      "usage": {
        "input_tokens": 24835,
        "output_tokens": 4050,
        "cache_creation_input_tokens": 0,
        "cache_read_input_tokens": 0
      },
      "estimatedCostUsd": 0.045085,
      "estimatedCostEur": 0.039585
    },
    {
      "eventId": "c7c8ab9e42af5ba6fed8824268caede2967064577c0d99c82f1a03254b11e648",
      "occurredAt": "2026-08-10T09:03:39.440846+00:00",
      "reportType": "daily",
      "reportId": "2026-08-10",
      "model": "claude-sonnet-4-6",
      "outcome": "end_turn",
      "measured": true,
      "usage": {
        "input_tokens": 15143,
        "output_tokens": 7173,
        "cache_creation_input_tokens": 0,
        "cache_read_input_tokens": 0
      },
      "estimatedCostUsd": 0.153024,
      "estimatedCostEur": 0.134355
    },
    {
      "eventId": "8693d611cdda04edc391662cb3c293db6ac24c1fe10b53469f76a8ba967b2ce1",
      "occurredAt": "2026-08-10T09:04:35.860968+00:00",
      "reportType": "daily",
      "reportId": "2026-08-10",
      "model": "claude-haiku-4-5-20251001",
      "outcome": "end_turn",
      "measured": true,
      "usage": {
        "input_tokens": 8997,
        "output_tokens": 5812,
        "cache_creation_input_tokens": 0,
        "cache_read_input_tokens": 0
      },
      "estimatedCostUsd": 0.038057,
      "estimatedCostEur": 0.033414
    },
    {
      "eventId": "df87630eb2a51e52dfbf0a9857ab5e2a707d12df38673920bb04c5f0ae1e2d7f",
      "occurredAt": "2026-08-10T09:09:20.178528+00:00",
      "reportType": "week",
      "reportId": "2026-W32",
      "model": "claude-sonnet-4-6",
      "outcome": "end_turn",
      "measured": true,
      "usage": {